{
  "artifactKind": "compare-report",
  "comparabilityFailures": [],
  "comparabilityPolicy": {
    "mode": "strict",
    "requireTimingClass": "operation"
  },
  "comparabilitySummary": {
    "nonComparableCount": 0,
    "workloadCount": 1
  },
  "comparisonStatus": "comparable",
  "generatedAt": "2026-04-11T00:13:22.516306+00:00",
  "outPath": "bench/out/apple-metal/20260411T001309Z/gemma64.node-package.warm.ir.compare.json",
  "overall": {
    "baselineStatsMs": {
      "count": 15,
      "maxMs": 248.615006,
      "meanMs": 242.07167966666665,
      "minMs": 238.746277,
      "p10Ms": 239.161253,
      "p50Ms": 241.541608,
      "p95Ms": 245.859252,
      "p99Ms": 245.859252,
      "stdevMs": 2.5756672430651633
    },
    "comparisonStatsMs": {
      "count": 15,
      "maxMs": 150.473004,
      "meanMs": 144.99406966666666,
      "minMs": 141.566136,
      "p10Ms": 141.861233,
      "p50Ms": 143.746247,
      "p95Ms": 150.064283,
      "p99Ms": 150.064283,
      "stdevMs": 2.957707408629971
    },
    "deltaPercent": {
      "meanPercent": -66.95281415521065,
      "p10Percent": -68.5881674241475,
      "p50Percent": -68.03333168065248,
      "p95Percent": -63.83595555512701,
      "p99Percent": -63.83595555512701
    }
  },
  "overallWorkloadUnitWall": {
    "baselineStatsMs": {
      "count": 15,
      "maxMs": 0.2468055196581197,
      "meanMs": 0.24034832148148147,
      "minMs": 0.23652827692307687,
      "p10Ms": 0.23690235042735042,
      "p50Ms": 0.2401836538461538,
      "p95Ms": 0.24362368205128207,
      "p99Ms": 0.24362368205128207,
      "stdevMs": 0.00264189896118527
    },
    "comparisonStatsMs": {
      "count": 15,
      "maxMs": 0.14755146068376065,
      "meanMs": 0.14250424267806266,
      "minMs": 0.13928504273504272,
      "p10Ms": 0.13965947264957265,
      "p50Ms": 0.14082133162393162,
      "p95Ms": 0.14745502136752137,
      "p99Ms": 0.14745502136752137,
      "stdevMs": 0.0029876841880929136
    },
    "deltaPercent": {
      "meanPercent": -68.66046720058888,
      "p10Percent": -69.62855861684032,
      "p50Percent": -70.55914120140037,
      "p95Percent": -65.2189798569606,
      "p99Percent": -65.2189798569606
    }
  },
  "participants": {
    "left": {
      "executorId": "doe_node_webgpu_prepared",
      "hostIdentity": {
        "adapter": {
          "architecture": "M3",
          "description": "Apple M3",
          "device": "Apple M3",
          "vendor": "Apple"
        },
        "api": "metal",
        "arch": "arm64",
        "driver": "1.0.0",
        "hostname": "mac.lan",
        "kernel": "25.3.0",
        "os": "darwin"
      },
      "product": "doe_gpu_node_package_prepared",
      "runtimeIdentity": {
        "binaryPath": "/Users/xyz/.nvm/versions/node/v22.20.0/bin/node",
        "binarySha256": "49161ba4e67afda85c25b2daa1f0e91d1bffc023d2dbc4886eda7a9ba38bca62",
        "executionBackend": "doe_node_webgpu",
        "packageLockHash": "d55ed7c8ca8c8b4d57b9188e9da82a01e219151370540c95ae6e31515d4c4419",
        "packageName": "doe-gpu",
        "packageVersion": "0.3.4",
        "providerId": "doe",
        "providerName": "doe-gpu",
        "runtimeHost": "node"
      }
    },
    "right": {
      "executorId": "node_webgpu_package_prepared",
      "hostIdentity": {
        "adapter": {
          "architecture": "",
          "description": "",
          "device": "",
          "vendor": "apple"
        },
        "api": "metal",
        "arch": "arm64",
        "driver": "1.0.0",
        "hostname": "mac.lan",
        "kernel": "25.3.0",
        "os": "darwin"
      },
      "product": "node_webgpu_package_prepared",
      "runtimeIdentity": {
        "binaryPath": "/Users/xyz/.nvm/versions/node/v22.20.0/bin/node",
        "binarySha256": "49161ba4e67afda85c25b2daa1f0e91d1bffc023d2dbc4886eda7a9ba38bca62",
        "executionBackend": "node_webgpu_package",
        "packageLockHash": "",
        "packageName": "node-webgpu",
        "packageVersion": "",
        "providerId": "node-webgpu",
        "providerName": "node-webgpu",
        "runtimeHost": "node"
      }
    }
  },
  "primaryMetric": "measured_ms",
  "runReceiptPaths": [
    "bench/out/apple-metal/20260411T001309Z/gemma64.node-package.warm.ir.workspace/run-artifacts/doe_gpu_node_package_prepared/doe_gpu_node_package_prepared-inference_gemma3_270m_prefill_64tok_decode_64tok-20260411T001309Z.run.json",
    "bench/out/apple-metal/20260411T001309Z/gemma64.node-package.warm.ir.workspace/run-artifacts/node_webgpu_package_prepared/node_webgpu_package_prepared-inference_gemma3_270m_prefill_64tok_decode_64tok-20260411T001309Z.run.json"
  ],
  "schemaVersion": 1,
  "workloadManifest": {
    "freshnessReason": "manifest differs from generated lane apple_metal in backend workload catalog",
    "generatedAt": "2026-04-09T01:07:40.463440+00:00",
    "generatorId": "bench.tools.generate_backend_workloads:materialize_lane",
    "generatorInputHash": "00724779bc2a031518e8ae7c7cc3126f0cadb24cc5f38fef6dc116b1bb703b57",
    "inputFreshness": "stale",
    "ownership": "generated",
    "path": "bench/workloads/workloads.apple.metal.json",
    "sha256": "77f1202991771a57041409fa2ff20f9d9eb97815dd4d86a7f37b6206ae39a480"
  },
  "workloads": [
    {
      "baselineStatsMs": {
        "count": 15,
        "maxMs": 248.615006,
        "meanMs": 242.07167966666665,
        "minMs": 238.746277,
        "p10Ms": 239.161253,
        "p50Ms": 241.541608,
        "p95Ms": 245.859252,
        "p99Ms": 245.859252,
        "stdevMs": 2.5756672430651633
      },
      "benchmarkClass": "comparable",
      "claimEligible": true,
      "comparability": {
        "advisoryFailedObligations": [],
        "baselineCommandRepeat": 1,
        "baselineExecutionErrorSampleCount": 0,
        "baselineExecutionShapes": [
          {
            "executionDispatchCount": 1170,
            "executionRowCount": 1583,
            "executionSuccessCount": 1583
          }
        ],
        "baselineNormalizedExecutionShapes": [
          {
            "executionDispatchCount": 1170,
            "executionRowCount": 1583,
            "executionSuccessCount": 1583
          }
        ],
        "baselineQueueSyncModes": [
          "per-command"
        ],
        "baselineResourceProbeAvailableCount": 0,
        "baselineResourceSampleMedian": 6,
        "baselineResourceSamplingTruncatedCount": 0,
        "baselineTimingClass": "operation",
        "baselineTimingSelectionPolicies": [
          "<none>"
        ],
        "baselineTimingSources": [
          "doe-execution-total-ns"
        ],
        "baselineTraceMetaSources": [
          "doe-execution-total-ns"
        ],
        "blockingFailedObligations": [],
        "comparable": true,
        "comparisonCommandRepeat": 1,
        "comparisonExecutionErrorSampleCount": 0,
        "comparisonExecutionShapes": [
          {
            "executionDispatchCount": 1170,
            "executionRowCount": 1583,
            "executionSuccessCount": 1583
          }
        ],
        "comparisonNormalizedExecutionShapes": [
          {
            "executionDispatchCount": 1170,
            "executionRowCount": 1583,
            "executionSuccessCount": 1583
          }
        ],
        "comparisonQueueSyncModes": [
          "per-command"
        ],
        "comparisonResourceProbeAvailableCount": 0,
        "comparisonResourceSampleMedian": 4,
        "comparisonResourceSamplingTruncatedCount": 0,
        "comparisonTimingClass": "operation",
        "comparisonTimingSelectionPolicies": [
          "<none>"
        ],
        "comparisonTimingSources": [
          "doe-execution-total-ns"
        ],
        "comparisonTraceMetaSources": [
          "doe-execution-total-ns"
        ],
        "obligationSchemaVersion": 2,
        "obligations": [
          {
            "applicable": true,
            "blocking": true,
            "details": {
              "workloadComparable": true
            },
            "id": "workload_marked_comparable",
            "passes": true
          },
          {
            "applicable": true,
            "blocking": true,
            "details": {
              "baselineSampleCount": 15
            },
            "id": "left_samples_present",
            "passes": true
          },
          {
            "applicable": true,
            "blocking": true,
            "details": {
              "comparisonSampleCount": 15
            },
            "id": "right_samples_present",
            "passes": true
          },
          {
            "applicable": true,
            "blocking": true,
            "details": {
              "baselineTimingClasses": [
                "operation"
              ]
            },
            "id": "left_single_timing_class",
            "passes": true
          },
          {
            "applicable": true,
            "blocking": true,
            "details": {
              "comparisonTimingClasses": [
                "operation"
              ]
            },
            "id": "right_single_timing_class",
            "passes": true
          },
          {
            "applicable": true,
            "blocking": true,
            "details": {
              "baselineTimingClass": "operation",
              "requiredTimingClass": "operation"
            },
            "id": "left_required_timing_class",
            "passes": true
          },
          {
            "applicable": true,
            "blocking": true,
            "details": {
              "comparisonTimingClass": "operation",
              "requiredTimingClass": "operation"
            },
            "id": "right_required_timing_class",
            "passes": true
          },
          {
            "applicable": true,
            "blocking": true,
            "details": {
              "baselineTimingClass": "operation",
              "comparisonTimingClass": "operation"
            },
            "id": "baseline_comparison_timing_class_match",